[
  {
    "title": "Enterprise Customer Success Manager",
    "company": "Harvey",
    "location": "New York, NY",
    "remote": "remote",
    "source": "ashby",
    "url": "https://jobs.ashbyhq.com/harvey/0d750bf9-d3f2-4816-9e28-23d12a0ef2e2",
    "apply_url": "https://jobs.ashbyhq.com/harvey/0d750bf9-d3f2-4816-9e28-23d12a0ef2e2/application",
    "posted": "2026-07-01",
    "score": 92,
    "timing": "unstated",
    "rationale": "Owns adoption and renewal for Harvey's enterprise legal accounts, the closest match to her Dolce and Gabbana portfolio, QBR and expansion work, Tier 1 customer success with no PM or engineering screen.",
    "signal": "ashby adapter, employer board, fetched 2026-08-17",
    "resume_tailored": true
  },
  {
    "title": "Majors Customer Success Manager (Asset Management)",
    "company": "Harvey",
    "location": "New York, NY",
    "remote": "remote",
    "source": "ashby",
    "url": "https://jobs.ashbyhq.com/harvey/993e43fa-a9a1-45be-9d74-3a96c7c303ef",
    "apply_url": "https://jobs.ashbyhq.com/harvey/993e43fa-a9a1-45be-9d74-3a96c7c303ef/application",
    "posted": "2026-07-22",
    "score": 89,
    "timing": "unstated",
    "rationale": "Tier 1 customer success role for Harvey's largest accounts, same adoption and renewal motion as her D&G portfolio, gap is the asset management and Fortune 500 vertical depth the posting prefers.",
    "signal": "ashby adapter, employer board, fetched 2026-08-17",
    "resume_tailored": false
  },
  {
    "title": "Forward Deployed Product Manager, Enterprise",
    "company": "Scale AI",
    "location": "New York, NY",
    "remote": "onsite",
    "source": "greenhouse",
    "url": "https://job-boards.greenhouse.io/scaleai/jobs/4673051005",
    "apply_url": "https://job-boards.greenhouse.io/scaleai/jobs/4673051005",
    "posted": "2026-08-04",
    "score": 87,
    "timing": "unstated",
    "rationale": "Titled product manager but the requirements accept a customer-facing product ownership background as an alternative to a PM title, which is exactly her sell-in tool product ownership, Tier 1 deployment ownership with a moderate PM-screen risk.",
    "signal": "greenhouse adapter, employer board, fetched 2026-08-17",
    "resume_tailored": false
  },
  {
    "title": "Mid-Market Customer Success Manager",
    "company": "Harvey",
    "location": "New York, NY",
    "remote": "remote",
    "source": "ashby",
    "url": "https://jobs.ashbyhq.com/harvey/c2e8772a-ca9c-44ee-95fb-bbd64f57e7c4",
    "apply_url": "https://jobs.ashbyhq.com/harvey/c2e8772a-ca9c-44ee-95fb-bbd64f57e7c4/application",
    "posted": "2026-02-17",
    "score": 83,
    "timing": "unstated",
    "rationale": "Same Tier 1 CSM motion as the other two Harvey rows, a mid-market book of 40 plus clients rather than a handful of majors, the volume of concurrent accounts is the one thing she has not run at this scale.",
    "signal": "ashby adapter, employer board, fetched 2026-08-17",
    "resume_tailored": false
  },
  {
    "title": "Forward Deployed Product Manager, AI Agent",
    "company": "Cresta",
    "location": "United States (Remote)",
    "remote": "remote",
    "source": "greenhouse",
    "url": "https://job-boards.greenhouse.io/cresta/jobs/4738837008",
    "apply_url": "https://job-boards.greenhouse.io/cresta/jobs/4738837008",
    "posted": "2026-08-03",
    "score": 82,
    "timing": "unstated",
    "rationale": "Titled forward deployed but the requirements are technology consulting, implementations and customer success with the FDEs doing the heavy build, so Tier 1 deployment ownership, gap is direct AI agent building experience.",
    "signal": "greenhouse adapter, employer board, fetched 2026-08-17",
    "resume_tailored": false
  },
  {
    "title": "GTM Technology Product Owner",
    "company": "Harvey",
    "location": "New York, NY",
    "remote": "remote",
    "source": "ashby",
    "url": "https://jobs.ashbyhq.com/harvey/320427e4-333f-445c-87f1-67d08ab0fa6c",
    "apply_url": "https://jobs.ashbyhq.com/harvey/320427e4-333f-445c-87f1-67d08ab0fa6c/application",
    "posted": "2026-06-23",
    "score": 79,
    "timing": "unstated",
    "rationale": "Titled GTM but the requirements are internal systems ownership, data integrity and dedup, exactly her sell-in tool product-owner work, not GTM strategy, so scored as her old-job tier rather than the GTM tier.",
    "signal": "ashby adapter, employer board, fetched 2026-08-17",
    "resume_tailored": false
  },
  {
    "title": "Associate Forward Deployed Product Manager",
    "company": "Cresta",
    "location": "United States (Remote)",
    "remote": "remote",
    "source": "greenhouse",
    "url": "https://job-boards.greenhouse.io/cresta/jobs/4992510008",
    "apply_url": "https://job-boards.greenhouse.io/cresta/jobs/4992510008",
    "posted": "2026-08-03",
    "score": 77,
    "timing": "unstated",
    "rationale": "Entry-level forward deployed PM, the stated qualifying background explicitly includes consulting and customer or sales engineer roles with a low technical bar, gap is that the scope is more junior than her current seniority.",
    "signal": "greenhouse adapter, employer board, fetched 2026-08-17",
    "resume_tailored": false
  },
  {
    "title": "Enterprise Account Manager",
    "company": "Replit",
    "location": "New York, NY (SoHo)",
    "remote": "hybrid",
    "source": "ashby",
    "url": "https://jobs.ashbyhq.com/replit/ebc39bd6-f32b-4e1b-bda2-30467453c725",
    "apply_url": "https://jobs.ashbyhq.com/replit/ebc39bd6-f32b-4e1b-bda2-30467453c725/application",
    "posted": "2026-06-05",
    "score": 76,
    "timing": "unstated",
    "rationale": "Enterprise account retention and expansion at a developer-tools AI company, close to her CSM background, gap is the coding-familiarity the posting prefers and no account-manager title at a software company.",
    "signal": "ashby adapter, employer board, fetched 2026-08-17",
    "resume_tailored": false
  },
  {
    "title": "Senior Solutions Engineer",
    "company": "Decagon",
    "location": "New York, NY",
    "remote": "onsite",
    "source": "ashby",
    "url": "https://jobs.ashbyhq.com/decagon/73ef8e9d-a6b3-4817-ab02-893c4ac72bad",
    "apply_url": "https://jobs.ashbyhq.com/decagon/73ef8e9d-a6b3-4817-ab02-893c4ac72bad/application",
    "posted": "2026-01-16",
    "score": 74,
    "timing": "unstated",
    "rationale": "Titled solutions engineer but the requirements are pre-sales discovery and demo building rather than a hard engineering bar, so Tier 1 solutions consulting, gap is the 4 to 6 years of dedicated pre-sales experience she does not have.",
    "signal": "ashby adapter, employer board, fetched 2026-08-17",
    "resume_tailored": false
  },
  {
    "title": "Program Manager, GTM Systems",
    "company": "Anthropic",
    "location": "New York, NY",
    "remote": "hybrid",
    "source": "greenhouse",
    "url": "https://job-boards.greenhouse.io/anthropic/jobs/5363352008",
    "apply_url": "https://job-boards.greenhouse.io/anthropic/jobs/5363352008",
    "posted": "2026-08-03",
    "score": 71,
    "timing": "unstated",
    "rationale": "Cross-functional GTM systems coordination close to her single-point-of-contact role at LVMH, Tier 2 GTM, gap is no formal program manager or RevOps systems title and the GTM function itself remains a gap.",
    "signal": "greenhouse adapter, employer board, fetched 2026-08-17",
    "resume_tailored": false
  },
  {
    "title": "Revenue Strategy & Operations Manager",
    "company": "Decagon",
    "location": "New York, NY",
    "remote": "onsite",
    "source": "ashby",
    "url": "https://jobs.ashbyhq.com/decagon/4ac15d8e-8c15-4411-89d4-f5215a6720b1",
    "apply_url": "https://jobs.ashbyhq.com/decagon/4ac15d8e-8c15-4411-89d4-f5215a6720b1/application",
    "posted": "2026-04-08",
    "score": 70,
    "timing": "unstated",
    "rationale": "Tier 2 RevOps role owning GTM KPIs and reporting, overlaps with her account health monitoring tool work, gap is the RevOps or investment banking background the posting prefers and the GTM title itself.",
    "signal": "ashby adapter, employer board, fetched 2026-08-17",
    "resume_tailored": false
  },
  {
    "title": "Manager, Customer Success - Beneficial Deployments",
    "company": "Anthropic",
    "location": "New York, NY",
    "remote": "hybrid",
    "source": "greenhouse",
    "url": "https://job-boards.greenhouse.io/anthropic/jobs/5383204008",
    "apply_url": "https://job-boards.greenhouse.io/anthropic/jobs/5383204008",
    "posted": "2026-08-12",
    "score": 67,
    "timing": "unstated",
    "rationale": "Tier 1 CSM work managing a nonprofit account portfolio, but requires 3 plus years directly managing a CSM team, which is not on her record despite her field enablement experience, named as the gap.",
    "signal": "greenhouse adapter, employer board, fetched 2026-08-17",
    "resume_tailored": false
  },
  {
    "title": "GTM Enablement Manager",
    "company": "Glean",
    "location": "New York, NY (hybrid, one of NYC, Nashville, SF or Mountain View)",
    "remote": "hybrid",
    "source": "greenhouse",
    "url": "https://job-boards.greenhouse.io/gleanwork/jobs/4718547005",
    "apply_url": "https://job-boards.greenhouse.io/gleanwork/jobs/4718547005",
    "posted": "2026-07-24",
    "score": 65,
    "timing": "unstated",
    "rationale": "Tier 2 product enablement translating releases into field-ready training, overlaps with her field rollout and training work, gap is no formal enablement or product marketing title.",
    "signal": "greenhouse adapter, employer board, fetched 2026-08-17",
    "resume_tailored": false
  },
  {
    "title": "Private Equity Partnerships Manager",
    "company": "Glean",
    "location": "New York, NY",
    "remote": "hybrid",
    "source": "greenhouse",
    "url": "https://job-boards.greenhouse.io/gleanwork/jobs/4673788005",
    "apply_url": "https://job-boards.greenhouse.io/gleanwork/jobs/4673788005",
    "posted": "2026-08-12",